{
  "building": {
    "scalar_heat_load": 1.0,
    "scalar_electrical_load": 1.0,
    "fabric_intervention_index": 0,
    "floor_area": null,
    "incumbent": false,
    "age": 0,
    "lifetime": 30
  },
  "data_centre": {
    "maximum_load": 50.0,
    "hotroom_temp": 43.0,
    "incumbent": false,
    "age": 0,
    "lifetime": 10
  },
  "domestic_hot_water": {
    "cylinder_volume": 100.0,
    "incumbent": false,
    "age": 0,
    "lifetime": 12
  },
  "electric_vehicles": {
    "flexible_load_ratio": 0.5,
    "small_chargers": 0,
    "fast_chargers": 3,
    "rapid_chargers": 0,
    "ultra_chargers": 0,
    "scalar_electrical_load": 3.0,
    "incumbent": false,
    "age": 0,
    "lifetime": 15
  },
  "energy_storage_system": {
    "capacity": 20.0,
    "charge_power": 10.0,
    "discharge_power": 10.0,
    "battery_mode": "CONSUME",
    "initial_charge": 0.0,
    "incumbent": false,
    "age": 0,
    "lifetime": 15
  },
  "gas_heater": {
    "maximum_output": 40,
    "gas_type": "NATURAL_GAS",
    "boiler_efficiency": 0.9,
    "fixed_gas_price": 0.068,
    "incumbent": false,
    "age": 0,
    "lifetime": 10
  },
  "grid": {
    "grid_export": 23.0,
    "grid_import": 23.0,
    "import_headroom": 0.25,
    "tariff_index": 0,
    "export_tariff": 0.05,
    "incumbent": false,
    "age": 0,
    "lifetime": 25
  },
  "heat_pump": {
    "heat_power": 20.0,
    "heat_source": "AMBIENT_AIR",
    "send_temp": 70.0,
    "incumbent": false,
    "age": 0,
    "lifetime": 10
  },
  "mop": {
    "maximum_load": 300.0,
    "incumbent": false,
    "age": 0,
    "lifetime": 10
  },
  "solar_panels": [
    {"yield_scalar": 20, "yield_index":  0, "incumbent": false, "age": 0, "lifetime": 25}
  ]
}
